{
  "$schema": "https://json-schema.org/draft/2020-12/schema",
  "title": "TestPilot result 0.1.0",
  "type": "object",
  "additionalProperties": false,
  "required": [
    "schema_version",
    "project_id",
    "checkout_id",
    "action_id",
    "run_id",
    "attempt_id",
    "kind",
    "status",
    "exit_code",
    "signal",
    "started_at",
    "ended_at",
    "duration_ms",
    "reason",
    "counts",
    "artifacts",
    "missing_artifacts",
    "provenance"
  ],
  "properties": {
    "schema_version": {
      "const": "0.1.0"
    },
    "project_id": {
      "type": "string",
      "pattern": "^[a-z][a-z0-9_.-]{0,95}$"
    },
    "checkout_id": {
      "type": "string",
      "pattern": "^[a-z][a-z0-9_.-]{0,95}$"
    },
    "action_id": {
      "type": "string",
      "pattern": "^[a-z][a-z0-9_.-]{0,95}$"
    },
    "run_id": {
      "type": "string",
      "pattern": "^[a-z][a-z0-9_.-]{0,95}$"
    },
    "attempt_id": {
      "type": "string",
      "pattern": "^[a-z][a-z0-9_.-]{0,95}$"
    },
    "kind": {
      "enum": [
        "test",
        "check"
      ]
    },
    "status": {
      "enum": [
        "queued",
        "running",
        "passed",
        "failed",
        "blocked",
        "cancelled",
        "timed_out",
        "runner_error",
        "inconclusive"
      ]
    },
    "exit_code": {
      "type": [
        "integer",
        "null"
      ],
      "minimum": 0,
      "maximum": 255
    },
    "signal": {
      "type": [
        "integer",
        "null"
      ],
      "minimum": 1,
      "maximum": 64
    },
    "started_at": {
      "anyOf": [
        {
          "type": "string",
          "format": "date-time",
          "pattern": "^[0-9]{4}-[0-9]{2}-[0-9]{2}T[0-9]{2}:[0-9]{2}:[0-9]{2}(?:\\.[0-9]{1,6})?Z$"
        },
        {
          "type": "null"
        }
      ]
    },
    "ended_at": {
      "anyOf": [
        {
          "type": "string",
          "format": "date-time",
          "pattern": "^[0-9]{4}-[0-9]{2}-[0-9]{2}T[0-9]{2}:[0-9]{2}:[0-9]{2}(?:\\.[0-9]{1,6})?Z$"
        },
        {
          "type": "null"
        }
      ]
    },
    "duration_ms": {
      "type": [
        "integer",
        "null"
      ],
      "minimum": 0
    },
    "reason": {
      "type": "string",
      "pattern": "^[a-z][a-z0-9_.-]{0,95}$"
    },
    "counts": {
      "type": "object",
      "additionalProperties": false,
      "required": [
        "discovered",
        "executed",
        "passed",
        "failed",
        "skipped"
      ],
      "properties": {
        "discovered": {
          "type": [
            "integer",
            "null"
          ],
          "minimum": 0
        },
        "executed": {
          "type": [
            "integer",
            "null"
          ],
          "minimum": 0
        },
        "passed": {
          "type": [
            "integer",
            "null"
          ],
          "minimum": 0
        },
        "failed": {
          "type": [
            "integer",
            "null"
          ],
          "minimum": 0
        },
        "skipped": {
          "type": [
            "integer",
            "null"
          ],
          "minimum": 0
        }
      }
    },
    "artifacts": {
      "type": "array",
      "items": {
        "type": "object",
        "additionalProperties": false,
        "required": [
          "path",
          "sha256",
          "media_type",
          "size_bytes",
          "redacted"
        ],
        "properties": {
          "path": {
            "type": "string",
            "minLength": 1,
            "maxLength": 1024,
            "pattern": "^(?!/)(?!.*:)(?!.*\\\\)(?!.*(?:^|/)\\.\\.(?:/|$))(?!.*[\\u0000-\\u001f]).+$"
          },
          "sha256": {
            "type": "string",
            "pattern": "^[a-f0-9]{64}$"
          },
          "media_type": {
            "type": "string",
            "minLength": 1,
            "maxLength": 4096
          },
          "size_bytes": {
            "type": "integer",
            "minimum": 0,
            "maximum": 10485760
          },
          "redacted": {
            "const": true
          }
        }
      },
      "minItems": 0,
      "maxItems": 256
    },
    "missing_artifacts": {
      "type": "array",
      "items": {
        "type": "string",
        "minLength": 1,
        "maxLength": 1024,
        "pattern": "^(?!/)(?!.*:)(?!.*\\\\)(?!.*(?:^|/)\\.\\.(?:/|$))(?!.*[\\u0000-\\u001f]).+$"
      },
      "minItems": 0,
      "maxItems": 256
    },
    "provenance": {
      "type": "object",
      "additionalProperties": false,
      "required": [
        "commit",
        "dirty",
        "content_sha256",
        "action_sha256",
        "environment"
      ],
      "properties": {
        "commit": {
          "type": "string",
          "pattern": "^[a-f0-9]{40}$"
        },
        "dirty": {
          "type": "boolean"
        },
        "content_sha256": {
          "type": "string",
          "pattern": "^[a-f0-9]{64}$"
        },
        "action_sha256": {
          "type": "string",
          "pattern": "^[a-f0-9]{64}$"
        },
        "environment": {
          "type": "string",
          "minLength": 1,
          "maxLength": 4096
        }
      }
    }
  },
  "allOf": [
    {
      "if": {
        "properties": {
          "status": {
            "enum": [
              "queued",
              "running"
            ]
          }
        }
      },
      "then": {
        "properties": {
          "ended_at": {
            "type": "null"
          },
          "exit_code": {
            "type": "null"
          },
          "signal": {
            "type": "null"
          }
        }
      },
      "else": {
        "properties": {
          "ended_at": {
            "type": "string",
            "format": "date-time",
            "pattern": "^[0-9]{4}-[0-9]{2}-[0-9]{2}T[0-9]{2}:[0-9]{2}:[0-9]{2}(?:\\.[0-9]{1,6})?Z$"
          }
        }
      }
    },
    {
      "if": {
        "properties": {
          "status": {
            "const": "queued"
          }
        }
      },
      "then": {
        "properties": {
          "started_at": {
            "type": "null"
          }
        }
      }
    },
    {
      "if": {
        "properties": {
          "status": {
            "enum": [
              "running",
              "passed",
              "failed",
              "cancelled",
              "timed_out"
            ]
          }
        }
      },
      "then": {
        "properties": {
          "started_at": {
            "type": "string",
            "format": "date-time",
            "pattern": "^[0-9]{4}-[0-9]{2}-[0-9]{2}T[0-9]{2}:[0-9]{2}:[0-9]{2}(?:\\.[0-9]{1,6})?Z$"
          }
        }
      }
    },
    {
      "if": {
        "properties": {
          "status": {
            "const": "passed"
          }
        }
      },
      "then": {
        "properties": {
          "exit_code": {
            "const": 0
          },
          "signal": {
            "type": "null"
          },
          "missing_artifacts": {
            "maxItems": 0
          },
          "artifacts": {
            "minItems": 1
          }
        }
      }
    },
    {
      "if": {
        "properties": {
          "status": {
            "const": "passed"
          },
          "kind": {
            "const": "test"
          }
        }
      },
      "then": {
        "properties": {
          "counts": {
            "properties": {
              "executed": {
                "type": "integer",
                "minimum": 1
              },
              "failed": {
                "const": 0
              },
              "passed": {
                "type": "integer",
                "minimum": 1
              },
              "discovered": {
                "type": "integer",
                "minimum": 1
              },
              "skipped": {
                "type": "integer",
                "minimum": 0
              }
            }
          }
        }
      }
    }
  ]
}
