{
  "schema_version": "0.1.0",
  "project_id": "fixture",
  "checkout_id": "fixture-main",
  "action_id": "test.synthetic",
  "run_id": "run.synthetic",
  "attempt_id": "attempt.one",
  "kind": "test",
  "status": "passed",
  "exit_code": 0,
  "signal": null,
  "started_at": "2026-09-07T00:00:00Z",
  "ended_at": "2026-09-07T00:00:01Z",
  "duration_ms": 1000,
  "reason": "assertions.passed",
  "counts": {
    "discovered": 2,
    "executed": 2,
    "passed": 2,
    "failed": 0,
    "skipped": 0
  },
  "artifacts": [
    {
      "path": "report.json",
      "sha256": "0000000000000000000000000000000000000000000000000000000000000000",
      "media_type": "application/json",
      "size_bytes": 1,
      "redacted": true
    }
  ],
  "missing_artifacts": [],
  "provenance": {
    "commit": "0000000000000000000000000000000000000000",
    "dirty": false,
    "content_sha256": "0000000000000000000000000000000000000000000000000000000000000000",
    "action_sha256": "0000000000000000000000000000000000000000000000000000000000000000",
    "environment": "synthetic fixture; not an actual run"
  }
}
